08:09:32.225015 IP Comp3134-Winter2025-lamp-ubuntu.ssh > bras-base-toroon10-grc-67-76-69-9-174.dsl.bell.ca.57126: Flags [P.], seq 66820:67184, ack 3061, win 513, length 364
08:09:32.280235 IP bras-base-toroon10-grc-67-76-69-9-174.dsl.bell.ca.57126 > Comp3134-Winter2025-lamp-ubuntu.ssh: Flags [.], ack 67184, win 252, length 0
08:09:32.328964 IP Comp3134-Winter2025-lamp-ubuntu.ssh > bras-base-toroon10-grc-67-76-69-9-174.dsl.bell.ca.57126: Flags [P.], seq 67184:67548, ack 3061, win 513, length 364
08:09:32.385417 IP bras-base-toroon10-grc-67-76-69-9-174.dsl.bell.ca.57126 > Comp3134-Winter2025-lamp-ubuntu.ssh: Flags [.], ack 67548, win 251, length 0
08:09:32.433099 IP Comp3134-Winter2025-lamp-ubuntu.ssh > bras-base-toroon10-grc-67-76-69-9-174.dsl.bell.ca.57126: Flags [P.], seq 67548:67760, ack 3061, win 513, length 212
08:09:32.433186 IP Comp3134-Winter2025-lamp-ubuntu.ssh > bras-base-toroon10-grc-67-76-69-9-174.dsl.bell.ca.57126: Flags [P.], seq 67760:67956, ack 3061, win 513, length 196
08:09:32.439335 IP bras-base-toroon10-grc-67-76-69-9-174.dsl.bell.ca.57126 > Comp3134-Winter2025-lamp-ubuntu.ssh: Flags [.], ack 67956, win 255, length 0